{
  "script_id": "SCRIPT_20260402_091615_67323619",
  "timestamp": "2026-04-02T15:16:15.770433+00:00",
  "status": "healthy",
  "source_bundle": "BUNDLE_20260402_091224_515831e6",
  "source_templates": "TMPL_20260402_091424_b5c91d77",
  "scripts": [
    {
      "id": "SCR_b15ee7594d0b",
      "trend_title": "AI system learns to keep warehouse robot traffic running smoothly",
      "template_id": "tutorial-standard",
      "template_name": "AI Tool Tutorial",
      "format": "standard",
      "estimated_duration": 240,
      "hook": "The fastest way to get started with smoothly",
      "sections": [
        {
          "section": "hook",
          "content": "[HOOK] The fastest way to get started with smoothly",
          "duration_seconds": 19,
          "notes": "What you'll learn/build"
        },
        {
          "section": "intro",
          "content": "[CONTEXT] Background on this development...",
          "duration_seconds": 28,
          "notes": "Tool overview and prerequisites"
        },
        {
          "section": "step_1",
          "content": "[STEP_1] Walk through this step...",
          "duration_seconds": 48,
          "notes": "First major step"
        },
        {
          "section": "step_2",
          "content": "[STEP_2] Walk through this step...",
          "duration_seconds": 48,
          "notes": "Second major step"
        },
        {
          "section": "step_3",
          "content": "[STEP_3] Walk through this step...",
          "duration_seconds": 48,
          "notes": "Third major step"
        },
        {
          "section": "demo",
          "content": "[DEMO] Let me show you how this works...",
          "duration_seconds": 28,
          "notes": "Show the final result"
        },
        {
          "section": "tips",
          "content": "[TIPS] Pro tips to get the most out of this...",
          "duration_seconds": 12,
          "notes": "Pro tips and gotchas"
        },
        {
          "section": "cta",
          "content": "[CTA] Subscribe for more AI insights. Drop a comment with your thoughts.",
          "duration_seconds": 7,
          "notes": "Subscribe for more tutorials"
        }
      ],
      "variables": {
        "headline": "AI system learns to keep warehouse robot traffic running smoothly",
        "source": "MIT News AI",
        "summary": "This new approach adapts to decide which robots should get the right of way at every moment, avoiding congestion and increasing throughput.",
        "category": "ai_research"
      },
      "differentiation": [
        "Multi-modal presentation combining code, visuals, and narration",
        "Unique perspective from AI-powered content pipeline",
        "Real-time data integration and live demonstrations"
      ]
    },
    {
      "id": "SCR_06fb702c5ee7",
      "trend_title": "Cognichip wants AI to design the chips that power AI, and just raised $60M to try",
      "template_id": "news-standard",
      "template_name": "AI News Coverage",
      "format": "standard",
      "estimated_duration": 150,
      "hook": "The AI world is buzzing about Cognichip wants AI to design the chips that power AI, and just raised $60M to try",
      "sections": [
        {
          "section": "hook",
          "content": "[HOOK] The AI world is buzzing about Cognichip wants AI to design the chips that power AI, and just raised $60M to try",
          "duration_seconds": 15,
          "notes": "Why you should care about this"
        },
        {
          "section": "context",
          "content": "[CONTEXT] Background on this development...",
          "duration_seconds": 22,
          "notes": "Background and context"
        },
        {
          "section": "details",
          "content": "[DETAILS] The firm says it can reduce the cost of chip development by more than 75% and cut the timeline by more than half....",
          "duration_seconds": 52,
          "notes": "Core story details"
        },
        {
          "section": "analysis",
          "content": "[ANALYSIS] Here's why this matters: What this means for the industry",
          "duration_seconds": 37,
          "notes": "What this means for the industry"
        },
        {
          "section": "takeaway",
          "content": "[TAKEAWAY] The key point to remember...",
          "duration_seconds": 15,
          "notes": "Key takeaway for viewers"
        },
        {
          "section": "cta",
          "content": "[CTA] Subscribe for more AI insights. Drop a comment with your thoughts.",
          "duration_seconds": 7,
          "notes": "Subscribe/follow prompt"
        }
      ],
      "variables": {
        "headline": "Cognichip wants AI to design the chips that power AI, and just raised $60M to try",
        "source": "TechCrunch AI",
        "summary": "The firm says it can reduce the cost of chip development by more than 75% and cut the timeline by more than half.",
        "category": "ai"
      },
      "differentiation": [
        "Code-first implementation walkthrough",
        "Multi-modal presentation combining code, visuals, and narration",
        "Unique perspective from AI-powered content pipeline",
        "Real-time data integration and live demonstrations"
      ]
    },
    {
      "id": "SCR_8b63cb8f51f5",
      "trend_title": "Mercor says it was hit by cyberattack tied to compromise of open source LiteLLM project",
      "template_id": "news-standard",
      "template_name": "AI News Coverage",
      "format": "standard",
      "estimated_duration": 150,
      "hook": "Here's why Mercor says it was hit by cyberattack tied to compromise of open source LiteLLM project changes everything",
      "sections": [
        {
          "section": "hook",
          "content": "[HOOK] Here's why Mercor says it was hit by cyberattack tied to compromise of open source LiteLLM project changes everything",
          "duration_seconds": 15,
          "notes": "Why you should care about this"
        },
        {
          "section": "context",
          "content": "[CONTEXT] Background on this development...",
          "duration_seconds": 22,
          "notes": "Background and context"
        },
        {
          "section": "details",
          "content": "[DETAILS] The AI recruiting startup confirmed a security incident after an extortion hacking crew took credit for stealing data from the company's systems....",
          "duration_seconds": 52,
          "notes": "Core story details"
        },
        {
          "section": "analysis",
          "content": "[ANALYSIS] Here's why this matters: What this means for the industry",
          "duration_seconds": 37,
          "notes": "What this means for the industry"
        },
        {
          "section": "takeaway",
          "content": "[TAKEAWAY] The key point to remember...",
          "duration_seconds": 15,
          "notes": "Key takeaway for viewers"
        },
        {
          "section": "cta",
          "content": "[CTA] Subscribe for more AI insights. Drop a comment with your thoughts.",
          "duration_seconds": 7,
          "notes": "Subscribe/follow prompt"
        }
      ],
      "variables": {
        "headline": "Mercor says it was hit by cyberattack tied to compromise of open source LiteLLM project",
        "source": "TechCrunch AI",
        "summary": "The AI recruiting startup confirmed a security incident after an extortion hacking crew took credit for stealing data from the company's systems.",
        "category": "ai"
      },
      "differentiation": [
        "Code-first implementation walkthrough",
        "Multi-modal presentation combining code, visuals, and narration",
        "Unique perspective from AI-powered content pipeline",
        "Real-time data integration and live demonstrations"
      ]
    }
  ],
  "meta": {
    "version": "1.0.0",
    "service": "script_generator",
    "story_id": "SKYBEAM-STORY-010",
    "script_count": 3,
    "templates_used": [
      "news-standard",
      "tutorial-standard"
    ],
    "degraded": false
  }
}